username,text,date
JoeBiden,"Nevada, we’re taking our campaign to Henderson tomorrow, May 7th! Head to https://www.mobilize.us/joebiden/event/91903/?force_banner=true&amp;share_context=event-detail-page-modal&amp;share_medium=copy_link to RSVP and come join us.",2019-05-06
JoeBiden,"On this first day of Ramadan, Jill and I wish peace and happiness to Muslims around the world celebrating the holy month. Ramadan Kareem.",2019-05-06
JoeBiden,"Our country may seem more divided than ever, but I know our best days are still ahead. It’s time we lift our heads up and remember who we are. If you’re ready to get to work, join our campaign today.",2019-05-05
JoeBiden,"We’re in the battle for the soul of this nation, but I’ve never been more optimistic about our future. If we work together, I know we can get this country back on track. Join our campaign: https://joebiden.com/join/",2019-05-05
JoeBiden,America is an idea that has grown stronger through the unique contributions of Latinos. @latinovictoryus works tirelessly to empower the community — congrats on 5 years.,2019-05-05
JoeBiden,We’re kicking off this campaign on May 18th—and we need #TeamJoe’s help. Sign up to host a house party to tune in with your friends and family: https://www.mobilize.us/joebiden/event/create/,2019-05-05
JoeBiden,"Thank you for the warm welcome, Columbia! It’s always great to be back in South Carolina.",2019-05-04
JoeBiden,"I’ve seen the selfless heroism of firefighters firsthand — they run toward danger and risk their lives every single day for strangers. On International Firefighters' Day, I extend my deepest gratitude to all the men and women who keep our communities safe.",2019-05-04
JoeBiden,"Tough, resilient, and always full of hope — that’s the America I know and that’s the America we must restore. It’s time to dig deep, take action, and fight for the soul of this nation. Join our campaign and let’s get to work. https://joebiden.com/join/",2019-05-04
JoeBiden,"Since we launched our campaign last week, we’ve seen Americans in every corner of the country step up and say they’re in. Will you join us? Head to http://JoeBiden.com/join and be part of our team.",2019-05-03
JoeBiden,"Last year, Floridians voted to restore voting rights to those who served their time for felonies. But today, Florida's Senate votes on a bill that would instead create a modern-day poll tax, suppressing the vote of tens of thousands of Americans. This is unacceptable.",2019-05-03
JoeBiden,"On Holocaust Remembrance Day, let us pause and reflect on the millions of Jews who lost their lives at the hands of the Nazi regime. The events of the last few months remind us that it’s not enough to just say never again—we must speak up and act against hate.",2019-05-03
JoeBiden,"This country wasn’t built by Wall Street bankers and CEOs and Hedge Fund Managers. It was built by you — the great American middle class. I’m thankful for all the support this week from union membership and their families, including the IAFF.",2019-05-02
JoeBiden,"Today, the House votes on #HR9, the #ClimateActionNow Act, which restores our commitment to the #ParisAgreement. We need to face facts on climate change. It’s already here. It is a major threat to our future and we simply cannot wait to take action.",2019-05-02
JoeBiden,Happy 48th Birthday to @Amtrak and the incredible men and women whose tireless work every day keeps the trains running and our country moving.,2019-05-01
JoeBiden,I’m the proud husband of a teacher and know first-hand the impact of their work. Teachers around the country and in South Carolina deserve to earn a living wage and have smaller class sizes so that America can continue to out-educate and lead the world. #AllOutMay1,2019-05-01
JoeBiden,"The violence in Venezuela today against peaceful protesters is criminal. Maduro's regime is responsible for incredible suffering. The U.S. must stand with the National Assembly & Guaidó in their efforts to restore democracy through legitimate, internationally monitored elections.",2019-04-30
JoeBiden,It's no secret that I love ice cream. I enjoyed stopping by The Cone Shoppe in Monticello for some chocolate/vanilla twist soft serve and the chance to talk with some Iowans after our first campaign stop.,2019-04-30
JoeBiden,"It was great to see many of our first responders and union leaders in Cedar Rapids today. This country was built by hard working Americans like you, and I look forward to being back soon!",2019-04-30
JoeBiden,"Today, The House will hold it's first hearing on the Equal Rights Amendment in 36 years. It's way past time to give all people protection under the Constitution--human rights should never be caught up in the whims of whichever political party is in power. We need the #ERANow.",2019-04-30
JoeBiden,Serving as @BarackObama's Vice President was a privilege and an honor. We share the belief that America is a place where ordinary people do extraordinary things and anything is possible.,2019-04-30
JoeBiden,"Folks, we’re just getting started! I’ll be heading to Iowa next. Visit http://JoeBiden.com/events for event details and to RSVP. Hope to see you soon!",2019-04-29
JoeBiden,"We must turbocharge our efforts to address climate change that threatens communities across the country. Through clean, renewable energy and cleaner, safer, faster transportation, America will not only help the environment but provide millions of good-paying middle-class jobs.",2019-04-29
JoeBiden,"Whether you’re covered through your employer, on your own, or not at all - you should have a choice to buy into a public option health plan like Medicare.",2019-04-29
JoeBiden,"The Affordable Care Act was a huge step forward for this country. Now we have to finish the job and make health care a right, not a privilege, and give everyone the peace of mind they deserve.",2019-04-29
JoeBiden,"By making post-secondary education and training affordable to and making sure the economy works not only for folks with a four-year degree but also for those who complete on-the-job training and trade programs, too.",2019-04-29
JoeBiden,"Twelve years of education is not enough. In order to rebuild a strong middle class, we must provide skills needed to do the jobs of the 21st Century.",2019-04-29
JoeBiden,"We need to get rid of the capital gains loophole for multimillionaires. I’m going to change it so millionaires and billionaires don’t pay lower tax rates than teachers and firefighters. We need to reward work in this country, not just wealth.",2019-04-29
JoeBiden,"Companies continue to squeeze every last penny out of workers, making it harder and harder for Americans to make ends meet. It’s way past time we make a $15 minimum wage the law of the land.",2019-04-29
JoeBiden,This country wasn’t built by Wall Street bankers and CEOs and hedge fund managers. It was built by you. The great American middle class. That’s the story of America and together we can rebuild the backbone of this nation.,2019-04-29
JoeBiden,"As I shared in Pittsburgh today, there are three reasons I’m running for President - to restore the soul of our nation, rebuild its backbone - the middle class, and unify all Americans. If you stand with me, join our campaign:",2019-04-29
JoeBiden,"I'm sick of this President badmouthing unions. Labor built the middle class in this country. Minimum wage, overtime pay, the 40-hour week: they exist for all of us because unions fought for those rights. We need a President who honors them and their work.",2019-04-29
JoeBiden,"I couldn't be more proud to have the International Association of Fire Fighters on my team. Unions built the middle class in this country—and as President, I'll fight to strengthen them and grow the backbone of this country.",2019-04-29
JoeBiden,"I've said it before and I'll say it again. To speak to the middle class, we need to reject the super PAC system. That's exactly what this campaign is doing. https://www.huffpost.com/entry/joe-biden-rejects-help-from-new-super-pac_n_5cc47617e4b08e4e3482b2b1?49",2019-04-28
JoeBiden,Join me in Pittsburgh tomorrow for a discussion on my plan to build a middle class where everyone comes along. RSVP to let me know you’ll be there:,2019-04-28
JoeBiden,"Iowa, I'm headed to town this week! Let me know you'll join us by RSVPing at https://www.joebiden.com/events",2019-04-28
JoeBiden,"Dick Lugar was among the most decent men I have ever known. Kind, loyal, dedicated beyond measure to the service of the American people. Dick Lugar was my dear friend. Jill and I send our condolences to his wife Charlene and the entire Lugar family.",2019-04-28
JoeBiden,"Wishing everyone in the Orthodox Christian community a peaceful and joyful Easter celebration with friends, family and loved ones. God Bless.",2019-04-28
JoeBiden,"Jill and I are devastated to hear about today’s shooting at the Chabad Poway synagogue. No one should have to worship in fear. As a country, we must speak out against bigotry and gun violence. We’re in the battle for the soul of this nation—and it’s on all of us to act.",2019-04-28
JoeBiden,I have a message for #TeamJoe: Thank you!,2019-04-27
JoeBiden,I had the privilege to thank one of our grassroots donors. It's because of supporters like Josh we're able to make this campaign a reality and bring this country together.,2019-04-26
JoeBiden,Thank you to the women of @TheView for the conversation today. It’s always a pleasure to sit down with you at the table. #TheView Credit: ABC/Lorenzo Bevilaqua,2019-04-26
JoeBiden,Looking forward to joining the women of @TheView today for my first live interview since announcing my 2020 campaign for President. Tune in 11e|10c|p on @ABCNetwork. #TheView,2019-04-26
JoeBiden,UPDATE: We’re about to close the books on an AMAZING first day of our campaign. It’s not too late to be a part of it. Chip in before midnight to be a Day One donor. http://www.joebiden.com/donate #Joe2020,2019-04-25
JoeBiden,"Our campaign is off to a great start thanks to thousands of Americans who have made donations. If you haven’t had the chance just yet, I hope you will join us too! Head to http://www.joebiden.com/donate to make a donation today. #Joe2020",2019-04-25
JoeBiden,"Folks, earlier today I announced that I’m running for President of the United States. The strength of this movement depends on you. Head over to http://www.joebiden.com/donate to make a donation today. #Joe2020",2019-04-25
JoeBiden,"Our country is being put to the test, but I’ve never been more optimistic about America. Together we can do this. Make a Day One donation to join us. https://www.joebiden.com/donate #Joe2020",2019-04-25
JoeBiden,Hoy estoy anunciando mi candidatura para presidente de los Estados Unidos. Somos los Estados Unidos de America - y juntos no hay nada que no podamos hacer. Únete a nuestra campaña: http://www.joebiden.com #Joe2020,2019-04-25
JoeBiden,The core values of this nation… our standing in the world… our very democracy...everything that has made America -- America --is at stake. That’s why today I’m announcing my candidacy for President of the United States. #Joe2020,2019-04-25
JoeBiden,"The hard working men and women of @UFCW that I met today are going without pay during this strike. If you can, pitch in to make sure that those workers facing the greatest hardship are supported. https://www.gofundme.com/f/supportstopandshopworkers",2019-04-19
JoeBiden,My wife Jill always reminds me that any country that out-educates us will out-compete us. Our teachers must have the resources they need & the wages they deserve so that America will continue to lead the world. Great speech today on this from @rweingarten.,2019-04-18
JoeBiden,"I'm on my way up to a rally at #StopandShop in Boston to stand with some of the 31,000 @UFCW union members who are currently fighting against cuts to wages and health care for themselves and their families. Stand with us: http://supportstopandshopworkers.com/",2019-04-18
JoeBiden,"For centuries, Notre Dame Cathedral has withstood wars, revolutions, and the test of time. It is a symbol of faith & a testament to history. And even as our hearts break to see it burn today during the holiest week of the year for Catholics, I have faith that it will rise again.",2019-04-15
JoeBiden,This is powerful. I would encourage everyone to read and take to heart Kyle’s message on privilege.,2019-04-13
JoeBiden,"In the last 5 years, @StopandShop's parent company has bought back billions of dollars in stock. Now they want to cut employee wages &amp; benefits. This is wrong. I stand with the 31,000 @UFCW workers fighting for their healthcare. Join me and support them: http://supportstopandshopworkers.com/",2019-04-12
JoeBiden,,2019-04-06
JoeBiden,"I see that you are on the job and presidential, as always.",2019-04-04
JoeBiden,"Social norms are changing. I understand that, and I’ve heard what these women are saying. Politics to me has always been about making connections, but I will be more mindful about respecting personal space in the future. That’s my responsibility and I will meet it.",2019-04-03
JoeBiden,"Stoning people to death for homosexuality or adultery is appalling and immoral. Every single person on earth is entitled to be treated with dignity and to live without fear. There is no excuse—not culture, not tradition—for this kind of hate and inhumanity.",2019-03-29
JoeBiden,.@NRA opposition to a full reauthorization of the Violence Against Women Act is sickening. We must do more to protect victims of stalking and abuse. It makes no sense to allow those who perpetrated the abuse to have access to deadly firearms. We must stand up now for survivors.,2019-03-28
JoeBiden,"Whether on the assembly line, at the grocery store checkout, or in the boardroom, every woman deserves to make every penny a man doing the same job makes. The #PaycheckFairnessAct will help us get there. Congratulations @rosadelauro and thank you for your leadership on this.",2019-03-28
JoeBiden,I was honored to meet Vlad and Adrianna tonight at the #BidenCourageAwards. These young people exemplify what @ItsOnUs is all about. I hope their bravery inspires more to take action to change our culture. Join these leaders and sign the #ItsOnUs pledge: http://itsonus.org/pledge,2019-03-26
JoeBiden,"I’m proud of my alma mater @UDelaware &amp; the student organizers of @UDance for their commitment to fighting childhood cancer. Today, they are hosting a 12 hour dance marathon benefiting the @BePositiveFdn. Join me in supporting this worthy cause. https://www.udancede.org",2019-03-24
JoeBiden,"The people of Guatemala should be the ones to choose their next president. The stakes are high: promoting transparency, shared prosperity, and combating corruption. For this reason, the @TSEGuatemala needs to certify all eligible presidential candidates by the Sunday deadline.",2019-03-16
JoeBiden,Silence is complicity. Our children are listening. The time to speak out is now.,2019-03-15
JoeBiden,"Whether it is antisemitism in Pittsburgh, racism in Charlottesville, or the xenophobia and Islamophobia today in Christchurch, violent hate is on the march at home and abroad. We cannot stand by as mosques are turned into murder scenes.",2019-03-15
JoeBiden,"On behalf of Jill, myself, and all of the Bidens, our hearts go out to the community in Christchurch suffering from today’s senseless violence. Friday prayers for those who were gathered at their mosques has seen families torn apart by hate.",2019-03-15
JoeBiden,"No one should live in fear of being fired, evicted from their home, or denied service in a restaurant just because of their gender identity or who they love. The #EqualityAct is long overdue, and will ensure LGBTQ Americans are treated with the dignity and respect they deserve.",2019-03-14
JoeBiden,http://trn.trains.com/news/news-wire/2019/03/07-joe-boardman-former-amtrak-president-dies,2019-03-12
JoeBiden,"Joe Boardman led @Amtrak through difficult times, taking over during the worst economic crisis since the Depression, and starting a modernization that will help deliver the 21st century rail system America deserves. My thoughts are with his wife Joanne and their family.",2019-03-12
JoeBiden,"Each year on International Women’s Day, we reaffirm the straightforward truth that achieving the goal of full and equal rights for women is essential to the success of all our nations. More on #IWD2019 here: https://bit.ly/2XV1y1A",2019-03-09
JoeBiden,"You’re right, Cynthia. I was making a point in a foreign policy context, that under normal circumstances a Vice President wouldn’t be given a silent reaction on the world stage. But there is nothing decent about being anti-LGBTQ rights, and that includes the Vice President.",2019-02-28
JoeBiden,Notes are ready. Be sure to tune in at 3pm ET when I will sit down at @UDBidenSchool with author and historian @jmeacham to talk about his book “The Soul of America” and the state of our democracy today. http://udel.edu/udlive,2019-02-26
JoeBiden,"Foreign election interference is not only a serious threat to our democratic institutions, it’s a threat to our national security. Russia and other authoritarian regimes are actively seeking to try to change outcomes of our democratic elections, and we can’t allow that to happen.",2019-02-22
JoeBiden,"Today I congratulated President @IvanDuque on his successful visit to Washington. Maintaining strong bipartisan support for #Colombia is vitally important to meeting key security and economic challenges in the hemisphere, including humanitarian aid for refugees from #Venezuela.",2019-02-15
JoeBiden,"Stand with survivors and advocates like @nguyen_amanda, @ZerlinaMaxwell, @ruthmglenn, @DavidsonJess22, @Mariska, and so many others. Reauthorize VAWA now.",2019-02-15
JoeBiden,"There is nothing more powerful that Congress can do to help women, strengthen families, and save lives than reauthorizing VAWA. Now.",2019-02-15
JoeBiden,"VAWA’s power is that it gets stronger with each reauthorization. This year can be no different. Like was done in 2000 and 2005 and 2013, we must expand the reach of VAWA to respond to the needs of survivors at risk every day.",2019-02-15
JoeBiden,"One in five women will still be victims of rape or attempted rape in their lifetimes. On average, three women a day are murdered by their husbands or boyfriends. Nothing is more urgent than reauthorizing and expanding the law that makes women safer.",2019-02-15
JoeBiden,"Since the passage of VAWA, annual rates of domestic violence have dropped by 63%. The National Domestic Violence Hotline responds to more than 26,000 people a month, creating a safety net for survivors. We have made progress, but there is much more to do. Right now.",2019-02-15
JoeBiden,"When I wrote the Violence Against Women Act in 1994, I believed it would be a lifeline. But this Congress has turned it into a political football. It’s time to pass a strong reauthorization to the Violence Against Women Act. No more stalling. Lives are on the line.",2019-02-15
JoeBiden,"I know from personal experience the only way to overcome grief is to find purpose. The Parkland students & families will not allow us to turn away from our responsibilities to those 17 fallen angels. We aren’t there yet, but with their determination & insistence, we’ll get there.",2019-02-14
JoeBiden,"One year after the tragic massacre in Parkland, we’ve not done nearly enough to ensure this will never happen again. In the last year far too many have died from gun violence. But I have hope. #MSDStrong",2019-02-14
JoeBiden,Only a tyrant would prevent the delivery of food and medicine to people he claims to lead. The international community must support Juan Guaido and the National Assembly. It is time for Maduro to step aside and allow a democratic transition. The Venezuelan people deserve better.,2019-02-09
JoeBiden,John Dingell was the Dean of the House. He earned that title — not just because he was there the longest — but because he led with great moral courage and vision. He was a friend and I will miss him terribly. Debbie is in my prayers.,2019-02-08
JoeBiden,Stacey Abrams achieved in a matter of minutes something Donald Trump failed to do in over an hour -- to embrace and give voice to the spirit and core values that make America great.,2019-02-06
JoeBiden,Today far too many transgender youth continue to face rejection at home and discrimination in their communities. Check out the work @bidenfoundation is doing with @lgbtmap and @genderspectrum to support these young people: https://nbcnews.to/2WJHgYc #AdvancingAcceptance,2019-02-05
JoeBiden,"There is no place for racism in America. Governor Northam has lost all moral authority and should resign immediately, Justin Fairfax is the leader Virginia needs now.",2019-02-02
JoeBiden,"Through the #HandsOffIX website, @endrapeoncampus,@knowyourIX have helped thousands make their voices heard in the notice and comment process.",2019-02-01
JoeBiden,"Fellow @UDelaware Blue Hen @Sage_Gaea of @knowyourIX has done so much for the students of Delaware through her advocacy, and is now fighting for students across the country.",2019-02-01
JoeBiden,".@DavidsonJess22 of @endrapeoncampus has been advocating for safer campuses since long before I met her in the White House. Jess, I’m so grateful for your tireless work, and proud of all that you continue to accomplish.",2019-02-01
JoeBiden,Students and survivors are making their voices heard. Grassroots organizers are working to make sure these guidelines are never put into effect.,2019-02-01
JoeBiden,This week @bidenfoundation submitted a comment to the Department of Education about proposed changes to #TitleIX guidance. These new rules would endanger students and make it harder for survivors of sexual assault to seek justice.,2019-02-01
JoeBiden,"What happened today to @JussieSmollett must never be tolerated in this country. We must stand up and demand that we no longer give this hate safe harbor; that homophobia and racism have no place on our streets or in our hearts. We are with you, Jussie.",2019-01-30
JoeBiden,,2019-01-26
JoeBiden,"An untested rape kit means a survivor without justice. I wrote the first rape kit backlog law because every survivor deserves closure, and because evidence shows testing kits can identify men who have committed multiple rapes - and might again. Test every kit. Every single one.",2019-01-26
JoeBiden,The spirit of Dr. King is still with us. It has burrowed deep into the soul of this nation. It will not let us rest. On #MLKDay we must heed Dr. King’s admonition from his final sermon and do our part to “make America what it ought to be.”,2019-01-21
JoeBiden,"Congratulations to the two women who led the way: @RepLonghurst and @HansenForSenate, as well as all of the lawmakers, activists, and citizens who made this happen.",2019-01-17
JoeBiden,"“Equality of rights under the law shall not be denied or abridged on account of sex.” Another step forward for equality and basic dignity in Delaware tonight, as the Equal Rights Amendment is enshrined in our state’s Constitution.",2019-01-17
JoeBiden,"White supremacists and their shameful ideology should have no place in this country in 2019, let alone a voice of sympathy in the United States Congress.",2019-01-12
JoeBiden,"I know I’m a little biased, but this post from Jill @DrBiden in the #BidenForum is a must-read. Her story of the strong middle-class values that shaped her is America’s story. And she tells it so well.",2018-12-21
JoeBiden,It is clear this administration has abandoned those core American beliefs. Secretary Mattis’ presence and his voice of reason and experience will be missed in the Pentagon and the Situation Room.,2018-12-21
JoeBiden,"I’ve had disagreements with Secretary Mattis, but we shared the view — long-held by Democrats and Republicans in this nation — that respect for our allies and a commitment to the most important and effective alliances in history made America safer.",2018-12-21
JoeBiden,"Friends don't let friends go uninsured. If you still need health insurance for 2019, tomorrow, December 15th, is the last day to get it through http://HealthCare.gov. This is about your health and peace of mind for you and your loved ones — there's nothing more important.",2018-12-14
JoeBiden,"This summer, the @bidenfoundation asked you to share stories about the importance of family and community acceptance for #LGBTQ young people. Here’s what you’ve said so far:",2018-12-07
JoeBiden,Now that’s more like it.,2018-12-01
JoeBiden,"President George H.W. Bush was a decent, kind, and gracious statesman. This nation will miss him. Our condolences go out to the entire Bush family for their loss.",2018-12-01
JoeBiden,"Grateful for the time spent with loved ones this Thanksgiving, and grateful for the sacrifice of those military families whose loved ones are on duty, unable to be with their families. From our family to yours, Happy Thanksgiving.",2018-11-22
JoeBiden,"Betsy DeVos’ new Title IX rules will discourage sexual assault reporting and investigations. When 1 in 5 women experience sexual assault while in college, we can’t afford to go backwards. Share your views: https://www2.ed.gov/about/offices/list/ocr/docs/title-ix-nprm.pdf",2018-11-16
JoeBiden,"The fires continue to burn in California, and our firefighters are among those who are losing everything. Right now, no matter where you live, you can help. Please give to support firefighters who have lost their homes to the wildfires: https://foundation.iaff.org/",2018-11-15
