username,text,date
JoeBiden,"When we emerge from this crisis, we can't just go back to the way things were before. We have to build a better future for all. We can and will transform this nation — together.",2020-05-01
JoeBiden,"This crisis isn't about you, Mr. President. It's about the American people.",2020-05-01
JoeBiden,"We have lived long enough with a President who doesn’t think he is accountable to anyone, and takes responsibility for nothing. That’s not me. As a Presidential candidate, I’m accountable to the American people.",2020-05-01
JoeBiden,We need a president who listens.,2020-05-01
JoeBiden,We need more tests. Our front line workers need protective equipment. Americans need additional economic relief. Yet the Trump Administration is spending time and energy on President Trump's wasteful border wall. Unbelievable.,2020-05-01
JoeBiden,"The number is overwhelming, but each one represents a life thrown into uncertainty, a family unable to make ends meet, and a community worried about how it will recover. We have to do more to help them. Now.",2020-05-01
JoeBiden,"- More than 60,000 people in the U.S. have died - 30 million have filed for unemployment - At least 1 million have gotten sick Enough with the late night Twitter tantrums, Mr. President. It's time for you to step up and lead.",2020-05-01
JoeBiden,"Instead of preparing our country to fight COVID-19, Donald Trump wasted months and promised it would miraculously go away by April. He was wrong. And we're all paying the price.",2020-04-30
JoeBiden,An open and independent press is more important than ever in times like this. They deserve to be treated with respect — not belittled with schoolyard taunts from this president.,2020-04-30
JoeBiden,"Donald Trump either read his daily briefings and ignored the warnings, or didn't read them at all. Either way, it's a complete and unjustifiable dereliction of duty.",2020-04-30
JoeBiden,I’ve been a big fan of Megan’s for years and can’t wait to join her this afternoon. You can watch our chat live at 2:45 PM ET: https://joe.link/2VRzEUZ,2020-04-30
JoeBiden,"We may be physically apart, but we are all in this together.",2020-04-30
JoeBiden,"As president, I promise you I'll honor all those we've lost from COVID-19.",2020-04-30
JoeBiden,"The climate emergency isn't just a threat to our environment, it's a threat to our health, economy, and so much more. We have to get Donald Trump out of the White House and take action to combat it before it's too late.",2020-04-30
JoeBiden,"In the middle of a global pandemic, the Trump Administration is still working to gut the Affordable Care Act and rip health care away from millions. It's morally reprehensible. They need to drop the lawsuit immediately.",2020-04-30
JoeBiden,"With rent due in a few days and folks across the country worried they won't be able to make their payments, it's clear more needs to be done to provide relief. We need to freeze rent immediately for people who have lost their jobs and place a temporary ban on evictions.",2020-04-30
JoeBiden,"The words of a president matter — and Donald Trump has used his to downplay COVID-19, pass blame onto others, and mislead the American people. I will do the opposite.",2020-04-29
JoeBiden,"The Trump Admin failed to provide enough testing, PPE, and safety enforcement. Workers have gotten sick, plants have closed, and the meat supply is at risk. It's past time workers have the protections they need to stay healthy and do their job safely.",2020-04-29
JoeBiden,"""I wish he were president right now, but I can't wait until he is if all of us do our part to support the kind of person that we want back in the White House."" — @HillaryClinton Join us: http://JoeBiden.com/Join",2020-04-29
JoeBiden,Wear a mask in public. Read your daily briefings. Listen to the experts. This really isn't rocket science. It's common sense.,2020-04-29
JoeBiden,"Throughout our history, we have emerged from every crisis stronger than before — and we will again.",2020-04-29
JoeBiden,"We owe a profound debt of gratitude to the health care workers on the front lines of this fight. I checked in with Monica, an ICU Nurse, to talk about how she's getting through this and to thank her for all she's doing:",2020-04-29
JoeBiden,"I couldn't agree with @HillaryClinton more. We need a president who will listen to the science, bring us together, and lead with compassion and heart. If I have the honor of being elected, that's the exact kind of president I will be.",2020-04-29
JoeBiden,"There are nearly 330 million people in the United States — and according to the Trump White House, we've only conducted 5.4 million COVID-19 tests. It's abysmal. Donald Trump needs to scale up testing, and he needs to do it immediately.",2020-04-29
JoeBiden,Let me be very clear: No one is expendable. We shouldn’t allow rationing of health care that discriminates based on age or disability.,2020-04-29
JoeBiden,"The fact is there has been so much unnecessary death in this country. If we had listened to the experts and heeded their warnings, it could have been stopped short. But Donald Trump failed to act — and now the American people are paying the price.",2020-04-28
JoeBiden,"I’ve known @HillaryClinton for years, and know that her dedication and passion for bettering our country are second to none. I’m grateful for her endorsement and for her friendship — and look forward to working alongside her to get Donald Trump out of the White House.",2020-04-28
JoeBiden,"COVID-19 is affecting the entire nation, but the impact doesn’t look the same for everyone. I'm hosting a town hall on how COVID-19 is impacting women — and I'll be joined by special guest Hillary Clinton. Tune in now to watch:",2020-04-28
JoeBiden,"If you're excited too, join us at 3 PM ET:",2020-04-28
JoeBiden,(I'm with her.),2020-04-28
JoeBiden,"We're months into this crisis and workers still don't have enough protective equipment, there still aren't enough tests, and the death toll continues to rise. The President should spend less time congratulating himself and more time doing his job.",2020-04-28
JoeBiden,"We are months into this crisis, and health care workers still don’t have the protective equipment they need. It’s a national disgrace.",2020-04-28
JoeBiden,"Tomorrow afternoon, I'll be hosting a town hall on how COVID-19 is impacting women — and I'll be joined by a special guest. Tune in at 3 PM ET to watch: http://JoeBiden.com/Live",2020-04-28
JoeBiden,"The Trump Administration could have helped prevent this. But once again, they failed to take action — and now the American people are paying the price.",2020-04-28
JoeBiden,"Testing is the springboard we need to help get our economy safely up and running again. Trump could rapidly scale it up. He hasn’t. Instead, he’s passed blame and pushed sole responsibility to governors. We've got to do better. https://www.bloomberg.com/amp/news/articles/2020-04-27/biden-calls-for-more-virus-testing-public-health-jobs-corps",2020-04-27
JoeBiden,"COVID-19 is a danger to everyone. We will stop it by coming together as one America — not by targeting others. Thank you for helping lead this fight, @AndrewYang.",2020-04-27
JoeBiden,Join Senator Kamala Harris and Symone Sanders for a town hall addressing the impact and disparities of COVID-19 in the Black community. Tune in now:,2020-04-27
JoeBiden,"COVID-19 can hit anyone, anywhere — but it doesn’t affect every community equally. This afternoon, join Senator @KamalaHarris and @SymoneDSanders for a discussion on its disproportionate impact on communities of color. Tune in at 3:30 PM ET: http://JoeBiden.com/Live",2020-04-27
JoeBiden,"We want our country to get moving and healthy again. But we must take the necessary, rational steps, grounded in science, to do so safely, so COVID-19 doesn’t come roaring back.",2020-04-27
JoeBiden,"I'm incredibly honored by @SpeakerPelosi's endorsement and grateful for her historic leadership in Congress. Together, we helped pass Obamacare and together we can not only bring this country back from the brink from this current crisis, but transform it.",2020-04-27
JoeBiden,America has always met every big challenge with an even bigger solution — this moment should be no different. We need an infrastructure program that will combat climate change and create good-paying jobs at the same time.,2020-04-27
JoeBiden,"Wealthy firms with ties to Trump got millions, while countless small businesses were turned away. No wonder he wanted no one to watch how the money was deployed. The American people deserve rigorous oversight — and small businesses deserve relief. Now.",2020-04-26
JoeBiden,The American people are stepping up and rising to meet this moment. It's time for our president to do the same.,2020-04-26
JoeBiden,"Now more than ever, we need a president who will choose hope over fear, unity over division, truth over lies, and science over fiction.",2020-04-26
JoeBiden,"Imagine the future we can build with Donald Trump out of the White House. A future where: - Health care is a right - We combat climate change - We end our gun violence epidemic - Our government works for all — not just the powerful Let’s build that future, together.",2020-04-26
JoeBiden,The workers on the front lines of this crisis are risking their lives every day to combat COVID-19 and keep this country running. The least we can do is provide them the pay and protection they need and deserve.,2020-04-26
JoeBiden,"366 days ago, we launched this campaign. 192 days from now, we’ll beat Donald Trump. Let’s go win this thing, together.",2020-04-26
JoeBiden,I bet this made their day. Thank you for stepping up and doing what you can to help those on the front lines of this fight.,2020-04-25
JoeBiden,"Michelle, this is a great idea. Thank you for doing what you can to ensure folks have the masks they need to stay safe.",2020-04-25
JoeBiden,"Julie, I can’t thank you enough for all you’re doing to ensure folks have food and supplies during this crisis.",2020-04-25
JoeBiden,"This is great, Addie. Tell your mom and sister I say thank you for lending a helping hand to your neighbors.",2020-04-25
JoeBiden,"Amanda, this is remarkable. Thank you for stepping up and supporting our front line heroes. I know the staff will greatly appreciate your donations.",2020-04-25
JoeBiden,"Today, folks across the nation have showed their compassion by participating in our first ever #SOULSaturday. Tune in now as we end the day with a celebration for our campaign’s one year anniversary:",2020-04-25
JoeBiden,"One year ago, we launched this campaign. Whether you were on #TeamJoe from day one or have joined in recent weeks — I’m incredibly grateful for your support and hope I make you proud. Together, we’re going to beat Donald Trump, unite this country, and transform our nation.",2020-04-25
JoeBiden,It’s stories like these that make me so proud to be an American and make me confident that we will overcome this. Because there’s nothing the American people have been unable to accomplish when we do it together.,2020-04-25
JoeBiden,"After seeing the shortage of masks around the country, Marilyn decided to step up and organize efforts in Northern Virginia to make homemade masks. Because of her selfless work, countless front line workers have the masks they need to stay safe.",2020-04-25
JoeBiden,"Older adults are especially vulnerable to COVID-19. Recognizing that, Erica decided to organize youth in her community to buy groceries for seniors — ensuring they receive the food they need while staying safe at home. She's a true hero.",2020-04-25
JoeBiden,"Brien usually works at the Ford Plant in Rawsonville, Michigan, driving a semi. But when the plant started assembling much-needed ventilators, he courageously stepped up and volunteered to help. His selfless actions will no doubt save countless lives.",2020-04-25
JoeBiden,"John, a Facilities Maintainer from Staten Island, recently contracted and survived the coronavirus. Shortly after he recovered, a colleague contracted the virus and needed plasma to battle it. John heroically stepped up and donated his plasma to help his coworker.",2020-04-25
JoeBiden,"Across the country, people are stepping up and doing incredible things amid this pandemic. It’s who we are as Americans—in times of crisis, we stand as one. For #SOULSaturday, I called a few folks to thank them for all they’re doing. Here are some of their stories:",2020-04-25
JoeBiden,"Tonight, we’re hosting a #SOULSaturday rally to celebrate the one-year anniversary of our campaign! Join us at 7 PM ET: http://JoeBiden.com/Live",2020-04-25
JoeBiden,"We may be physically apart, but folks across the country are coming together to check in on their neighbors and thank our front line heroes. Use #SOULSaturday to show how you’re participating today.",2020-04-25
JoeBiden,"When I announced my campaign one year ago today, I said we were in a battle for the soul of the nation. One year later, that is as true as it has ever been. I believe we can and we will emerge from this crisis a stronger, better, and fairer nation. Together, as one America.",2020-04-25
JoeBiden,Donald Trump needs to step up and do everything he can to give our front line workers the protective equipment they need.,2020-04-25
JoeBiden,"I know times are tough, but we have to campaign as hard as ever to take the strongest fight possible to Donald Trump. He has a lot more money than us, and we need your help to close the gap. If you can, please chip in today:",2020-04-25
JoeBiden,"Folks, to celebrate the one-year anniversary of our campaign, we'll be hosting a #SOULSaturday Rally tomorrow night! We may be physically apart, but I hope you'll join us in coming together at 7 PM ET: http://JoeBiden.com/Live",2020-04-24
JoeBiden,"The health of the American people is not a joke, Mr. President.",2020-04-24
JoeBiden,"I can’t believe I have to say this, but please don’t drink bleach.",2020-04-24
JoeBiden,"Let me be clear: This crisis isn’t about you, Mr. President.",2020-04-24
JoeBiden,"Today, we remember the atrocities faced by the Armenian people in the Metz Yeghern — the Armenian Genocide. If elected, I pledge to support a resolution recognizing the Armenian Genocide and will make universal human rights a top priority.",2020-04-24
JoeBiden,"No matter who you supported throughout the primary, I want you to know that you have a home in our campaign. You’re not just wanted — you’re needed. Together, we will beat Donald Trump and transform this nation. Join us: http://JoeBiden.com/Join",2020-04-24
JoeBiden,These folks are American heroes.,2020-04-24
JoeBiden,"I know this is a dark time for so many people, just know that we will get through this. We will emerge from this crisis stronger than ever before.",2020-04-24
JoeBiden,"UV light? Injecting disinfectant? Here’s an idea, Mr. President: more tests. Now. And protective equipment for actual medical professionals.",2020-04-24
JoeBiden,"The words of a president matter — never more than in times of crisis. A president should seek to calm and heal, provide a steady hand, and a clear path forward. Instead, this is what we get from Donald Trump:",2020-04-24
JoeBiden,Donald Trump will always put his wealthy and well-connected friends first — that should come as no surprise. But to allow the banks to do it on the backs of small business owners in the middle of a global pandemic is a new low — even for him.,2020-04-23
JoeBiden,"To celebrate the one-year anniversary of our campaign, we're hosting our first #SOULSaturday this weekend. Folks across the nation will be taking time to check-in on neighbors and thank those on the front lines of this fight. I hope you'll join us: https://joe.link/3ayX7hK",2020-04-23
JoeBiden,"As Muslim families across America and around the world celebrate the beginning of Ramadan, @DrBiden and I want to extend our best wishes to all who are observing this holy month. Ramadan Mubarak.",2020-04-23
JoeBiden,Times of crisis often bring out our best. There are so many stories of good happening around the world amid the COVID-19 pandemic. Take a minute to read a few:,2020-04-23
JoeBiden,26 million people unemployed. That's not just a statistic — every one is a life thrown into uncertainty. Every worker left wondering when they will next see a paycheck is part of this American crisis — and Donald Trump isn't doing enough for them.,2020-04-23
JoeBiden,"Unlike our current president, I will always choose science over fiction.",2020-04-23
JoeBiden,"Make no mistake: The climate crisis poses an existential threat to our future. But I know the American people have the spirit, power, and ingenuity to meet the challenge head-on. There’s nothing we’ve been unable to accomplish when we do it together.",2020-04-23
JoeBiden,"Workers, like grocery store cashiers, are on the front lines of this crisis risking their lives every day to combat COVID-19 and keep this country running. President Trump is refusing to do his job, but we've got to do ours. Learn more: http://bit.ly/2XDPCDo #ShopSmart",2020-04-23
JoeBiden,Our planet cannot afford four more years of Donald Trump.,2020-04-23
JoeBiden,We have the power to change the future of our planet — and it starts at the ballot box this November.,2020-04-22
JoeBiden,"This #EarthDay, let’s recommit to doing everything in our power to combat climate change. That starts with voting Donald Trump out of the White House this November.",2020-04-22
JoeBiden,Stranger things have happened.,2020-04-22
JoeBiden,"Fifty years ago, #EarthDay began as a day of organizing that demonstrated the power of community action. This year, it’s also a reminder of everything that’s on the line if we do not get Donald Trump out of the White House.",2020-04-22
JoeBiden,"The climate emergency requires our urgent action. As president, I will: - Ensure we achieve a 100% clean energy economy and net-zero emissions by 2050 - Rejoin the #ParisAgreement and rally the world to go further - Make the largest-ever investment in clean energy",2020-04-22
JoeBiden,Join me on Earth Day for a virtual town hall with special guest Al Gore — on one of the most pressing issues facing our country and the world. Tune in now:,2020-04-22
JoeBiden,Join me on #EarthDay for a virtual town hall — on one of the most pressing issues facing the world. Tune in at 2:30 PM ET: http://JoeBiden.com/Live,2020-04-22
JoeBiden,"Throughout my career, I've been committed to the fight against climate change. And on day one as president, I'll get to work taking the drastic action we need to address this crisis. #EarthDay",2020-04-22
JoeBiden,"On #EarthDay, we're reminded that there is no more urgent crisis facing this nation, or the world, than the threat posed by climate change. We have to take drastic action before it’s too late — and that’s exactly what I will do as president. http://JoeBiden.com/Climate",2020-04-22
JoeBiden,"Folks, we just launched a special #EarthDay episode of Here's the Deal! Governor @JayInslee joins me for a discussion on COVID-19, climate change, and why he's supporting our campaign. Listen to the full episode now: http://JoeBiden.com/Heres-The-Deal",2020-04-22
JoeBiden,"The Trump Administration promised 27 million tests by the end of March. As of now, only 4 million have been completed. It’s unacceptable. We can’t safely reopen the economy without scaling up testing, and we can’t effectively scale up testing unless Donald Trump does his job.",2020-04-22
JoeBiden,"The Paycheck Protection Program was intended to send help to the small businesses that needed it most, but President Trump adopted an approach to help his high-priced friends. We've got to do better. Here's what I would do if I were president:",2020-04-21
JoeBiden,"The right to vote is the most fundamental American right there is. We need to immediately expand vote-by-mail, online voter registration, and early voting to ensure everyone can safely exercise their right to participate in our electoral process.",2020-04-21
JoeBiden,"I know COVID-19 is causing many people to feel anxious about what the future holds or lonely during this time of social distancing — and that's okay, just know that you're not alone. I've asked my friend, Dr. Vivek Murthy, to share a few tips on how to get through this:",2020-04-21
JoeBiden,"This Holocaust Remembrance Day, as we remember the millions of Jews who lost their lives at the hands of the Nazi regime, we recommit to ensuring such atrocities never again occur. With anti-Semitism on the rise, all of us must root out intolerance and give hate no safe harbor.",2020-04-21
JoeBiden,"Out of every trial and tribulation, America has always emerged stronger — and we will again. We will not be defeated.",2020-04-21
JoeBiden,"I am honored to have the endorsement of the League of Conservation Voters, a leading environmental advocacy organization. Climate change is an existential threat, and there is no greater challenge and opportunity facing our country and our world.",2020-04-21
JoeBiden,"In March alone, this campaign raised $46.7 million, with 70% from online donations. This virus has changed our campaign. But it hasn't changed the unwavering support we've gotten from all of you. Together, we're going to defeat Trump. Help keep us going:",2020-04-21
JoeBiden,The President needs to stop blaming others and do his job.,2020-04-21
JoeBiden,"Tune in now as @fred_guttenberg hosts a town hall on gun violence with #StudentsForBiden, 21 years after the Columbine High School massacre:",2020-04-20
JoeBiden,"No kid should fear for their life at school & no parent should worry whether their kid will come home safe. Today, 21 years after the Columbine shooting, @fred_guttenberg will host a town hall with students on how we can end this epidemic. Tune in at 7 PM: http://JoeBiden.com/Live",2020-04-20
JoeBiden,The office of the presidency comes with the ultimate responsibility for the biggest decisions in the world. Every great president throughout our history has met that duty with the leadership it demands. Donald Trump has not.,2020-04-20
JoeBiden,"Like many families, we have had to find new ways to stay connected while we're physically apart. We've been video chatting with our grandchildren a lot and decided to record one to share with you all. Take a look:",2020-04-20
JoeBiden,"On #SOULSaturday, folks will be doing everything from sewing masks and hosting food drives to writing letters to first responders and making calls to check in on neighbors. We are all in this together–and I hope you'll join us by signing up to take action:",2020-04-20
JoeBiden,"In times of crisis, Americans stand as one. We lend a hand to our neighbors and take care of those in need. It's who we are. In that spirit, and to celebrate the one-year anniversary of our campaign, we're hosting S.O.U.L. of the Nation Saturday this weekend.",2020-04-20
JoeBiden,"We have to come together to make Donald Trump a one-term president. Once we do that, we will not only do the hard work of rebuilding this nation — we will transform it and create a better future for all.",2020-04-20
JoeBiden,"On this week’s episode of Here’s the Deal, Senator @AmyKlobuchar joins me for a discussion on how COVID-19 has impacted her family and what drove her to get involved in politics. Listen to the full episode at: https://JoeBiden.com/Heres-The-Deal",2020-04-20
JoeBiden,"At a time when Trump is fanning the flames of white supremacy and hatred in our country, my heart is with the families of those we lost in the Oklahoma City bombing 25 years ago today. We must never give up the fight against these forces of hate and intolerance.",2020-04-20
JoeBiden,Tune in to watch @SymoneDSanders and actor @TonyGoldwyn host a town hall on how COVID-19 has impacted workers in the entertainment industry:,2020-04-19
JoeBiden,".@DrBiden and I are keeping the loved ones of the more than 40,000 people in the U.S. we've lost due to COVID-19 in our prayers. This is a solemn day for our nation, and there will be more hard days ahead. But if we pull together, we will get through this. I promise.",2020-04-19
JoeBiden,"Tonight, @SymoneDSanders and actor @TonyGoldwyn will be hosting a town hall focused on how COVID-19 is impacting workers in the entertainment industry. Tune in at 7 PM ET to watch: http://JoeBiden.com/Live",2020-04-19
JoeBiden,"To everyone working on the front lines of this crisis, thank you. We truly couldn't get through this without you.",2020-04-19
JoeBiden,"No President can promise to prevent future outbreaks. But I can promise you that when I'm President, we will prepare better, respond better, and recover better. We'll listen to the experts and heed their advice. And I will always tell you the truth.",2020-04-19
JoeBiden,"At a time when studies are linking air pollution with COVID-19 mortality rates for the most vulnerable in our society, the Trump Administration is rolling back environmental protections — allowing more poison into our air.",2020-04-19
JoeBiden,"As Kierkegaard said, “faith sees best in the dark.” I've always believed that. This pandemic is keeping many communities apart, but we've still got to keep the faith. Jill and I are wishing a Happy Easter to all of the Orthodox Christians celebrating around the world.",2020-04-19
JoeBiden,"The United States should be standing up for freedom and standing with the people of Hong Kong. Instead, Trump has said he's “standing with Xi Jinping.” That's weak. We need to be strong on values when it comes to China. That's what I'll do as president.",2020-04-19
