username,text,date
JoeBiden,Being a nation of immigrants is one of America's greatest strengths. It doesn't matter where your family comes from — we're bound by the same ideals and made up of the same grit and determination to succeed.,2019-09-16
JoeBiden,"We have not relegated racism and white supremacy to the pages of history. Lynch mobs, arsonists, bomb makers, and lone gunmen. We must give hate no safe harbor.",2019-09-16
JoeBiden,"Los Estados Unidos es una idea que se ha fortalecido a través de las contribuciones únicas de la comunidad hispana. ¿Dónde estaríamos sin la juez Sonia Sotomayor, César Chávez, @HildaSolis, Dolores Huerta y otros que han mejorado nuestro mundo? #HerenciaHispana",2019-09-15
JoeBiden,"America is an idea that has grown stronger through the unique contributions of Hispanic communities. Where would we be without Justice Sonia Sotomayor, César Chávez, @HildaSolis, Dolores Huerta and others who have changed our world for the better? #HispanicHeritageMonth",2019-09-15
JoeBiden,A job is about a lot more than a paycheck. It's about dignity and respect. Proud to stand with @UAW to demand fair wages and benefits for their members. America's workers deserve better.,2019-09-15
JoeBiden,"We are in a battle for the soul of this nation. And at the historic 16th Street Baptist church, there’s no more powerful reminder of what’s at stake. And no more poignant example of what is demanded of us in response.",2019-09-15
JoeBiden,"Today, we honor Addie Mae, Cynthia, Carole, Denise, and recommit to defeating the poisonous ideology of white supremacy that lit the fuse at the 16th Street Baptist Church.",2019-09-15
JoeBiden,"I’m speaking in Birmingham, Alabama, at the 16th St. Baptist Church memorial service. Join me in honoring those we lost:",2019-09-15
JoeBiden,"At 11:00 AM ET, I’ll be speaking at the 16th Street Baptist Church memorial service to commemorate the lives we lost 56 years ago. Join me in honoring Addie Mae, Cynthia, Carole, and Denise:",2019-09-15
JoeBiden,"Gun violence tragedies are not inevitable. Together, we can end this epidemic.",2019-09-14
JoeBiden,So great to visit the Ernest S. Sterling Student Life Center at Texas Southern University. Thanks for letting me join you for lunch. Go Tigers!,2019-09-14
JoeBiden,"Tomorrow, I’ll be in Birmingham, Alabama, to remember the lives we lost 56 years ago in the 16th Street Baptist Church bombing. Join me in honoring Addie Mae, Cynthia, Carole, and Denise at 11:00 AM ET.",2019-09-14
JoeBiden,Obamacare fue un gran avance: proporcionó protecciones a más de 100 millones de estadounidenses con afecciones preexistentes. No podemos parar allí. Como presidente protegeré y expandiré Obamacare para garantizar que todos tengamos acceso a atención médica asequible y de calidad.,2019-09-14
JoeBiden,"Obamacare was a huge step forward—providing protections to over 100 million Americans with pre-existing conditions. We can’t stop there. As president, I’ll protect & build on Obamacare to ensure every American has the peace of mind that comes with quality, affordable health care.",2019-09-14
JoeBiden,"My North Star as president will be rebuilding the backbone of this country — the middle class. And this time, we'll make sure everyone comes along.",2019-09-14
JoeBiden,"Debemos hacer todo lo que esté a nuestro alcance para abordar la emergencia climática. Como presidente, trabajaré para convertirnos en una economía de energía limpia con emisiones netas cero para el 2050. Volveremos a liderar el mundo en la lucha contra el cambio climático.",2019-09-14
JoeBiden,"We must do everything in our power to address the climate emergency. As president, I’ll put America on course to become a 100% clean energy economy with net-zero emissions by 2050. We will lead the world in the fight against climate change once again.",2019-09-14
JoeBiden,I’m running for president because we are in a battle for the soul of this nation. It’s time for us to pick our heads up and remember who we are — this is the United States of America. There’s not a single thing we can’t do.,2019-09-14
JoeBiden,"25 years ago this week, Senator Feinstein and I led the charge to ban assault weapons and high-capacity magazines. We beat the @NRA and got it done. As president, I’ll do it once again. We will get these military-style weapons off our streets.",2019-09-14
JoeBiden,"25 years ago, the Violence Against Women Act was signed into law, forever changing the culture around sexual assault and domestic violence in our nation. It's one of my proudest accomplishments. There's still more work to be done—and it's on all of us to finish the job. #VAWA25",2019-09-13
JoeBiden,I’ve learned that the way you deal with loss is by finding purpose — purpose in what you do. #DemDebate,2019-09-13
JoeBiden,"""Nothing about VAWA was easy or uncontroversial. It took four years from when I first introduced the bill in 1990 until it passed."" Read my full op-ed on the 25th anniversary of the Violence Against Women Act:",2019-09-13
JoeBiden,"At last night’s #DemDebate, I discussed my vision for the country and how I'll deliver tangible progress on the most pressing issues facing working families. I refuse to postpone American possibilities any longer. There’s enormous opportunity once we get rid of Donald Trump.",2019-09-13
JoeBiden,"I just stepped off the #DemDebate stage, where I laid out why I’m the only candidate who can take big progressive policies and create tangible results for working families. If you liked what you heard, help us keep this momentum going by pitching in:",2019-09-13
JoeBiden,"That’s all we have for tonight, folks! Thanks for following along. Make sure to follow @TeamJoe to stay up-to-date on what’s happening on the campaign. #DemDebate",2019-09-13
JoeBiden,We need a president who can deliver progress on the most pressing issues facing Americans. Joe Biden will be that president. #DemDebate,2019-09-13
JoeBiden,"There was only one candidate onstage who has the experience—from Scranton, PA, to the White House—to hit the ground running as President. And that candidate is Joe Biden. #DemDebate",2019-09-13
JoeBiden,"There was only one candidate onstage who helped create—and then signed—a Pledge for Election Integrity, promising to use no disinformation or tolerate outside interference in the election or our democracy. #DemDebate",2019-09-13
JoeBiden,There was only one candidate onstage who stood at President Obama’s side to lead a nation out of a recession and put middle-class Americans back to work. #DemDebate,2019-09-13
JoeBiden,There was only one candidate onstage who has flipped a Senator's vote to help pass once-in-a-century health care reform. #DemDebate,2019-09-13
JoeBiden,Ten candidates took the stage tonight. But there was only one candidate onstage who has defeated the NRA twice and passed an assault weapons ban. #DemDebate,2019-09-13
JoeBiden,The American people know Joe Biden. #DemDebate,2019-09-13
JoeBiden,It could take 10 years before we get to Medicare for All. We can't wait — people need help now and hope now. #DemDebate,2019-09-13
JoeBiden,"K-12 education isn’t enough. Many parents don’t have access to early educational resources for their kids. A Biden administration will provide Universal Pre-K, to help ensure that no child’s future is determined by their zip code, parents’ income, race, or disability. #DemDebate",2019-09-13
JoeBiden,"We must invest in resources that support our students' physical and emotional health. A Biden administration will double the number of psychologists, counselors, nurses, social workers, and other health professionals in our schools. #DemDebate",2019-09-13
JoeBiden,"There will be no better advocates in the White House for our students and educators than Joe and Jill Biden. Read our full plan for educators, students, and our future: http://JoeBiden.com/Education #DemDebate",2019-09-13
JoeBiden,"Throughout his career, Joe Biden has: Fought redlining. Fought school lines drawn to keep races & classes separate. Fought to put public housing in white neighborhoods. Fought for more resources to prosecute hate crimes. #DemDebate",2019-09-13
JoeBiden,It’s important to have a plan that meets the urgency of this climate crisis. But it’s going to take more than plans—it’s going to take leadership. Biden has the relationships with key foreign leaders and the experience to get this done. #DemDebate,2019-09-13
JoeBiden,Joe Biden knows how to rally the world to meet the climate crisis because he’s done it before. Biden worked alongside President Obama to get the world—including China—to agree to the Paris Accord; and he will be prepared on day one of his presidency to push beyond those goals.,2019-09-13
JoeBiden,It's past time to end the war in Afghanistan. Joe Biden has long believed that we should narrow our focus to counter-terrorism operations. We can't keep spending tens of billions of dollars every year to sustain a stalemate. #DemDebate,2019-09-13
JoeBiden,"If we don't write the rules to protect American labor and the environment, China will—and not in a way that advances our values. When it comes to trade, we've got to work with allies—not against them. #DemDebate",2019-09-13
JoeBiden,"For a socialist, Senator Sanders has a lot of confidence in corporate America. #DemDebate",2019-09-13
JoeBiden,"The Obama-Biden Administration did NOT prosecute asylum seekers, or those coming here in search of opportunity. #DemDebate",2019-09-13
JoeBiden,The Obama-Biden Administration did NOT terrorize families and indiscriminately target people who had lived here for years. #DemDebate,2019-09-13
JoeBiden,"The Obama-Biden Administration did not conduct workplace raids—in fact, it ended them. #DemDebate",2019-09-13
JoeBiden,Attempts to compare President Trump and President Obama on immigration are far-fetched. #DemDebate,2019-09-13
JoeBiden,"Time and again, we’ve seen communities ripped apart by America’s gun violence epidemic. Enough is enough. It needs to end. As president, Biden will tackle this public health crisis. #DemDebate",2019-09-13
JoeBiden,"After people serve their time, they should have an opportunity to earn a good life and contribute to our country. Joe’s plan will help give treatment, job training and education opportunities to people both during and after incarceration. #DemDebate",2019-09-13
JoeBiden,We are tearing communities apart through mass incarceration. That's why the Biden administration would reform the criminal justice system by: Reducing our prison population Eliminating racial disparities Making our communities safer Learn more:,2019-09-13
JoeBiden,There’s enormous opportunity once we get rid of Donald Trump. #DemDebate,2019-09-13
JoeBiden,"Senator Sanders' Medicare for All plan would require raising taxes on the middle class. Joe Biden: ""There will be a deductible—in your paycheck."" #DemDebate",2019-09-13
JoeBiden,Senator Sanders thinks corporations will give the money they would have spent on health care back to their workers. #DemDebate Joe Biden:,2019-09-13
JoeBiden,"""I know the Senator said she's for Bernie. I'm for Barack."" #DemDebate",2019-09-13
JoeBiden,90% of Democrats support protecting and building on Obamacare with a public option like Medicare. #DemDebate,2019-09-13
JoeBiden,Senators Sanders and Warren would put an end to the employer-sponsored and union-negotiated plans that more than 100 million Americans currently have. That's a non-starter for us. #DemDebate,2019-09-13
JoeBiden,Let’s get the facts straight: Medicare for All will cost 30x more than Joe Biden’s health care plan—and it will be paid for in part by raising taxes on the middle class. #DemDebate,2019-09-13
JoeBiden,Hey everyone — @TeamJoe here! We’re taking over to keep you updated on all the things happening at tonight’s #DemDebate. Make sure to follow along and cheer on Joe!,2019-09-13
JoeBiden,Ready. #DemDebate,2019-09-12
JoeBiden,"Helplessly watching your child deal with a life or death condition is one of the worst things a parent can go through. Jill and I are so glad to hear Sadie is doing well, @Bakari_Sellers, and our prayers are with your family as she recovers.",2019-09-12
JoeBiden,"President Trump’s decision to take billions from the military to build his wall is an unabashed abuse of power. It endangers the American people and forfeits investments in our future, security, and children — all to score political points.",2019-09-12
JoeBiden,The Trump Administration is denying Temporary Protected Status to Bahamians escaping the devastation of Hurricane Dorian. It’s heartless and goes against everything we stand for as a nation. The cruelty of this administration truly knows no bounds.,2019-09-12
JoeBiden,Barack Obama was a great president. We don’t say that enough.,2019-09-12
JoeBiden,"Beth James is strong, courageous, and resilient. Her story is the story of millions of women all across this country. It’s why I worked so hard to pass the Violence Against Women Act — and it’s why I’m committed to changing the toxic culture that still pervades our society today.",2019-09-12
JoeBiden,"All workers deserve the right to bargain for good wages, benefits and working conditions—including gig workers. That is why I'm pleased the CA Legislature passed AB5. As president, I will enact a federal law to ensure gig workers get the full protections they deserve.",2019-09-12
JoeBiden,"Climate change doesn’t only threaten our environment — it threatens our economy, health, and national security. We must take urgent action to address this crisis before it’s too late.",2019-09-12
JoeBiden,"Each 9/11, we remember that resilience and courage live in the hearts of all Americans—especially our brave first responders. 18 years later, we reaffirm that Americans will never bend to terrorism, and we will never forget those we lost.",2019-09-11
JoeBiden,La fuerza de los Estados Unidos está y siempre ha estado arraigada en nuestra diversidad. Los inmigrantes siempre nos han hecho más fuertes. Donald Trump no entiende eso.,2019-09-11
JoeBiden,America’s strength is and has always been rooted in our diversity. Immigrants have always made us stronger. Donald Trump doesn’t get that.,2019-09-11
JoeBiden,"Puerto Rico aún se está recuperando de la devastación del huracán María. Ahora, en lugar de apoyar la reconstrucción, Trump está desviando $400 millones de dólares para su construir su muro que estaban planificados para proyectos militares en Puerto Rico. Es inaceptable.",2019-09-10
JoeBiden,"Puerto Rico is still rebuilding from the devastation of Hurricane Maria. Now, instead of supporting the recovery, President Trump is defunding $400 million in planned military projects in Puerto Rico to build his wall. It's unacceptable.",2019-09-10
JoeBiden,"JoAnne, the good news is the bad news: you won the contest, and you're coming to Houston with me. Grateful for JoAnne's support and that of our incredible supporters.",2019-09-10
JoeBiden,"South Carolina lawmakers are rushing through an extreme law that is a direct violation of a woman’s constitutional right to choose. It’s wrong, it’s dangerous, and we must fight it. This decision should remain between a woman and her doctor.",2019-09-10
JoeBiden,"20 million people gained coverage under Obamacare. But after countless attacks on the law by the Trump Administration, the uninsured rate increased for the first time since 2010 — leaving an additional 1.9 million people uninsured. As president, I'll defend and build on the ACA.",2019-09-10
JoeBiden,"There is no distinction between mental health and physical health — it’s health. On #WorldSuicidePreventionDay, we must recommit to eliminating the stigma around mental health and ensuring everyone has access to the care they need.",2019-09-10
JoeBiden,"It’s Election Day in #NC09 — grab a friend and get out and vote for @McCreadyForNC. Polls are open until 7:30 PM, and you can find your polling place here: http://danmccready.com/electionday",2019-09-10
JoeBiden,"I support @McCreadyForNC because of his honorable service to our nation &amp; because of his values: he'll fight to protect North Carolinian’s health care &amp; take on prescription drug companies. If his opponent has his way, 44,000 people in #NC09 stand to lose their health coverage.",2019-09-10
JoeBiden,We’ve got to choose science over fantasy — and that starts with getting rid of this administration.,2019-09-10
JoeBiden,"Every American deserves to retire with dignity. But today, too many people — especially older Americans — cannot afford their prescription drugs. I sat down with AARP to discuss how I’ll stand up to the abuse of power by drug corporations and lower costs for Americans.",2019-09-09
JoeBiden,I’m still fired up from the incredible energy at the #NHDems2020 convention. Thank you to everyone from @TeamJoe who came out to show your support!,2019-09-09
JoeBiden,"Hurricane Dorian devastated the Bahamas, leaving nearly 70,000 people homeless. It’s our moral responsibility to do everything we can to help Bahamians — not turn them away. This isn’t who we are.",2019-09-09
JoeBiden,"With Congress back in session, passing gun safety legislation should be the first order of business. It’s past time for Mitch McConnell and Senate Republicans to stand up to the @NRA and take concrete action to end our gun violence epidemic.",2019-09-09
JoeBiden,Young Americans are especially worried about climate change and know it is not just a domestic priority — it's a foreign policy one. I agree. And I'm ready to tackle this on day one. http://JoeBiden.com/climate,2019-09-09
JoeBiden,I’m inspired by John and grateful for his support. My message to him is clear: never give up and never let it define you.,2019-09-09
JoeBiden,Mexico isn’t paying for the wall. American military families are. China isn’t paying for the tariffs. American farmers and manufacturers are. The American people continue to foot the bill for President Trump’s senseless political games.,2019-09-08
JoeBiden,"The deadliest mass shootings all have one thing in common: assault weapons. It’s past time we get these weapons of war off our streets. I’ve banned them before, and I’ll ban them again in the White House.",2019-09-08
JoeBiden,"As president, I’ll invest in our K-12 schools to eliminate the funding gap between majority white and non-white districts, and rich and poor districts. No child’s future should be determined by their zip code, parents’ income, or race.",2019-09-07
JoeBiden,Everybody knows who Donald Trump is. We have to let them know who we are. We choose hope over fear. Unity over division. Science over fiction. And truth over lies. #NHDems2020,2019-09-07
JoeBiden,Obamacare prohibits insurers from denying coverage for the 100 million Americans with pre-existing conditions. President Trump wants to gut the ACA and tear that protection away. We can’t forget that.,2019-09-07
JoeBiden,"It's time we reward work, not just wealth.",2019-09-07
JoeBiden,The @TeamJoe energy outside of the #NHDems2020 convention was incredible!,2019-09-07
JoeBiden,Stopped by to say hello to @TeamJoe before this morning’s #NHDems2020 convention. Thank you for all your hard work! Keep it going!,2019-09-07
JoeBiden,"Thank you to everyone who joined us in Laconia and New Castle. As I discussed this evening, we’ve got to do everything in our power to end this gun violence epidemic. That starts with passing universal background checks and banning assault weapons and high-capacity magazines.",2019-09-07
JoeBiden,Las políticas de inmigración del presidente Trump son un asalto a la dignidad humana y todo lo que representamos como nación. Por esto hay que acabar con ellas. https://time.com/5668567/migrant-children-mental-health-report/,2019-09-07
JoeBiden,President Trump’s immigration policies are an assault on human dignity and everything we stand for as a nation. We must end them. https://time.com/5668567/migrant-children-mental-health-report/,2019-09-07
JoeBiden,"This is the United States of America. There is not a single thing we have not been able to accomplish once we set our minds to it. Together, we can and will meet the challenge of this climate emergency.",2019-09-06
JoeBiden,"The Iran Deal put Iran's nuclear program in a box. Trump walked away from the deal, and now Iran is advancing its program. This is another reminder that Trump's manufactured crisis is making the U.S., the region, and our world less safe.",2019-09-06
JoeBiden,The fight against cancer is personal for me — like it is for so many Americans. It’s why I’m committed to ending cancer as we know it.,2019-09-06
JoeBiden,"America has stood as a beacon of hope for generations. Now, President Trump wants to slam the door in the face of those fleeing persecution. It's cruel and damages our global standing. I'll ensure we meet our responsibility as a nation to the world's most vulnerable people.",2019-09-06
JoeBiden,We all have a responsibility to stand up and speak out when we see abuse of power. Silence is complicity.,2019-09-06
JoeBiden,"President Trump stokes the flames of hatred, coddles white nationalists with messages of support, and preys on our deepest divisions. If we give him four more years in the White House, he will forever alter the character of our nation. We can’t let that happen.",2019-09-06
JoeBiden,I always enjoy sitting down to chat with my friend @StephenAtHome. Check out a few of my favorite moments from the interview.,2019-09-06
JoeBiden,"President Trump is dead wrong on climate change. We’ve got to choose science over fantasy and treat it like the existential threat that it is. As president, I would rally the world to take unprecedented action. There would be no empty chair at the G-7.",2019-09-05
JoeBiden,"Hace dos años, el presidente Trump intentó terminar con DACA, obligando a nuestros DREAMers a vivir con miedo y caos. Es cruel. Los soñadores son estadounidenses. Es hora de que el Congreso cumpla con nuestra promesa y les proporcione un camino hacia la ciudadanía.",2019-09-05
JoeBiden,"Two years ago, President Trump attempted to end DACA—throwing lives into chaos & forcing our DREAMers to live in fear as the Supreme Court decides their fate. It's cruel. DREAMers are Americans. It's time for Congress to keep our promise to them & provide a path to citizenship.",2019-09-05
JoeBiden,"Despite what the @NRA says, the assault weapons ban that @SenFeinstein and I championed worked. It saved lives. I’ll ban assault weapons and high-capacity magazines once again. We will get these weapons of war off our streets.",2019-09-05
JoeBiden,"Last night, @StephenAtHome asked me what the defining factor was in my decision to run for president. My answer was clear: Charlottesville.",2019-09-05
JoeBiden,"Thanks for having me on, @jimmykimmel!",2019-09-05
JoeBiden,"It’s critical to have a plan to combat climate change, but it’s going to take more than plans — it’s going to take leadership. I have the experience and relationships necessary to rally the world to meet the urgency of this climate crisis. #ClimateTownHall",2019-09-05
JoeBiden,That’s all we have for tonight’s CNN #ClimateTownHall! Make sure to follow @TeamJoe to stay up-to-date on everything happening on the campaign.,2019-09-05
JoeBiden,Joe Biden grounded his plan in the science — in what the world’s leading climatologists and the UN tells us we need to achieve. It provides a comprehensive path forward on how to address the most pressing issue of our time.,2019-09-05
JoeBiden,"Under Joe Biden’s plan for a clean energy revolution and environmental justice, we will: Achieve a 100% clean energy economy and net-zero emissions by 2050 Rejoin the #ParisAgreement on day one and rally the world to go further Stand up to polluters #ClimateTownHall",2019-09-05
JoeBiden,President Trump continues to: Deny the science in front of his own eyes Attack the progress made by the Obama-Biden Administration Spew lies like “windmills cause cancer” Defeating him is essential to making any progress on climate change. #ClimateTownHall,2019-09-05
JoeBiden,"Climate change is an urgent threat to our environment, health, economy, and national security. There’s no time for on-the-job training. We need a leader who is ready on day one — and that’s Joe Biden. #ClimateTownHall",2019-09-05
JoeBiden,"The clean energy economy of the future presents an enormous opportunity. President Biden will create 10 million well-paying jobs in the United States that will grow a stronger, more inclusive middle class in communities across the country. #ClimateTownHall",2019-09-05
JoeBiden,"The Green New Deal is a crucial framework for meeting the climate challenges we face. It powerfully captures two core truths: This is an existential crisis requiring immediate, ambitious action. Our environment and economy are connected. #ClimateTownHall",2019-09-05
JoeBiden,"If Joe Biden was president, there would be no empty chair at the G-7. #ClimateTownHall",2019-09-05
JoeBiden,We can't turn a blind eye to the way in which environmental burdens are distributed unevenly along racial and socioeconomic lines. Biden will right these wrongs and stand up to fossil fuel companies who disproportionately harm communities of color and low-income communities.,2019-09-05
JoeBiden,"Here’s the deal: Joe Biden introduced one of the first climate change bills in the Senate, and he’s been at the forefront of the fight ever since. Don’t just take our word for it, @PolitiFact called Joe Biden a climate change pioneer. #ClimateTownHall",2019-09-05
