username,text,date
JoeBiden,"This seems like a great reason to rejoin the Paris Agreement, @realDonaldTrump.",2020-01-15
JoeBiden,"I’m proud that today, our campaign is launching HBCU Students for Biden. This program will be dedicated to helping HBCU students throughout the country learn how to organize for our campaign. Sign up here: https://joe.link/hbcu",2020-01-15
JoeBiden,"I'm ready to debate Donald Trump on the economy. The American people are getting clobbered, and the wealthy are the only ones doing well. We have to rebuild the middle class, and this time, make sure everyone comes along.",2020-01-15
JoeBiden,"Cornell is right — everything is at stake this November. We have to get Donald Trump out of the White House and unite this country. Because if we come together and act as one America, there is nothing that we can't accomplish.",2020-01-15
JoeBiden,"Historically Black Colleges and Universities have always been the heartbeat of our country’s fight for justice. That’s why I’ll invest $70 billion in HBCUs and Minority-Serving Institutions. When HBCUs rise, we all rise—join HBCU Students for Biden today: http://joe.link/hbcu",2020-01-15
JoeBiden,"I just got off the debate stage in Iowa, where we're in the homestretch before the caucus. With just 19 days left, every dollar counts. Chip in if you're ready to take back this country and make Donald Trump a one-term president: https://joe.link/30nF62H",2020-01-15
JoeBiden,"This is the United States of America. There’s not a single thing beyond our capacity, if we do it together. Let’s go do it. #DemDebate",2020-01-15
JoeBiden,"With just 20 days until the Iowa Caucus, we need your help to fuel our campaign. Every donation—big or small—goes a long way in this homestretch. If you liked what you heard at tonight's #DemDebate, please chip in what you can to keep our momentum going:",2020-01-15
JoeBiden,"Look, I’ve been the object of Donald Trump’s affection now more than anyone else on this stage. I’ve taken all the hits he’s delivered, and I’m only getting stronger in the polls. #DemDebate",2020-01-15
JoeBiden,"Republicans have savaged my only surviving son. They’ve spread lies about me that networks won’t even carry. It doesn’t matter if they go after me. As President of the United States, I have to be able to not only fight — I have to heal. And that’s what I’ll do if I’m elected.",2020-01-15
JoeBiden,Child care is personal to me: I was a single parent as a young senator. I commuted home to Delaware every night to tuck my kids into bed. Child care should be affordable for every parent. #DemDebate,2020-01-15
JoeBiden,"Make no mistake, the situation with Iran is a crisis of Donald Trump’s own making. He claimed walking away from the Iran deal would deter Iranian aggression and result in a better deal. He failed on both accounts.",2020-01-15
JoeBiden,"Under the Biden administration, labor and environmental groups will be at the table to negotiate trade agreements. Period.",2020-01-15
JoeBiden,Medicare should be able to negotiate prices with drug companies. #DemDebate,2020-01-15
JoeBiden,"I’ve been very clear about what my health care plan would do: Build on Obamacare by giving Americans more choice, reducing health care costs, and making our health care system easier to navigate. #DemDebate",2020-01-15
JoeBiden,"If we don’t write the global rules of the road for trade, cyber, climate change, and so much more, they may be written by China or other nations that don’t share our values. #DemDebate",2020-01-15
JoeBiden,"I wouldn’t meet with Kim Jong Un without pre-conditions. By meeting with him, Donald Trump gave Kim Jong Un what he was looking for: legitimacy. I will work closely with our allies and hold China accountable for its lack of pressure on the Kim regime’s bad behavior. #DemDebate",2020-01-15
JoeBiden,No president can take our country to war without the informed consent of the American people. #DemDebate,2020-01-15
JoeBiden,There’s a big difference between sending tens of thousands of American combat troops to the Middle East indefinitely – which I oppose and will end – and using small teams of special forces to support local forces doing the fighting to advance our common security. #DemDebate,2020-01-15
JoeBiden,No one should shed a tear for Qassem Soleimani. But Trump’s reckless escalation and thoughtless withdrawal from the Iran nuclear deal has made America less safe. We need a return to diplomacy and a steady hand at the wheel to navigate an increasingly dangerous world. #DemDebate,2020-01-15
JoeBiden,"When Trump discarded the Iran nuclear deal he promised it would produce a “better” one and curb Iranian aggression—the reverse happened. Iran has restarted its nuclear program and become more provocative. I’ll return to smart, disciplined diplomacy to address the threats we face.",2020-01-15
JoeBiden,In 2009 President Obama asked me to oversee our effort to bring home our combat troops. I’ll put my record and my judgment up against anyone in terms of who is the right person to be Commander in Chief. #DemDebate,2020-01-15
JoeBiden,"I’m about to step on stage for tonight’s #DemDebate in Iowa. Make sure to follow along here and on @TeamJoe for updates throughout the night, and tune in to @CNN at 9 PM ET to watch live!",2020-01-15
JoeBiden,So much of what’s tearing this country apart can be fixed if we treat each other with basic dignity and respect once again. That starts with having a president who leads by example.,2020-01-15
JoeBiden,Donald Trump has once again sided with corporations over American workers by making it easier for them to get away with wage theft and overtime violations. It's time we put workers' rights over corporate greed and ensure everyone has the workplace protections they deserve.,2020-01-14
JoeBiden,We’re in a battle for the soul of our nation — and Donald Trump is poison to our soul. He has: - Fanned the flames of hatred and bigotry - Embraced dictators - Ripped children from their parents' arms - Degraded our national character We have to get him out of the White House.,2020-01-14
JoeBiden,"Why are you so obsessed with me, Mr. President?",2020-01-14
JoeBiden,"I'm married to a teacher, I see firsthand how difficult it is. We've got to let educators do their job so our students can succeed - that means paying them the salaries they deserve and giving them the respect that they've earned.",2020-01-14
JoeBiden,"From day one, Donald Trump has been determined to roll back every environmental protection he could get his hands on. At a time when the climate crisis is pushing our planet to the brink, we should strengthen protections — not weaken them.",2020-01-14
JoeBiden,The stakes of this election could not be higher. Eight years of Donald Trump will fundamentally alter the character of our nation. We can't let that happen. We have to do everything in our power to make him a one-term president.,2020-01-14
JoeBiden,"When we said to give us your tired, poor, and huddled masses, we absolutely did not mean ""unless they are fleeing violence.""",2020-01-14
JoeBiden,"Transit workers are being attacked every day, often while buses are moving, putting bus drivers and riders in harm's way. That's why I strongly support the Transit Worker and Pedestrian Protection Act to protect our workers from harm while doing their job.",2020-01-13
JoeBiden,"Donald Trump has no strategy when it comes to Iran. No endgame. The only way out of his self-made crisis is through diplomacy — clear-eyed, hard-nosed diplomacy grounded in strategy, that's not about one-off decisions or one-upmanship.",2020-01-13
JoeBiden,Come on. Your administration has been arguing in court to repeal protections for people with pre-existing conditions. You're trying to take health care away from millions of people. The least you could do is be honest about it.,2020-01-13
JoeBiden,"Cory, you campaigned with joy and heart, and instead of just talking about bringing people together, you did it every day. You made our politics better just by running. Grateful to you and looking forward to your continued leadership.",2020-01-13
JoeBiden,Puerto Rico should not be treated any differently than if this happened anywhere else in America — it's wrong. We should be surging all the help that is needed to fix the damage done by the earthquakes.,2020-01-13
JoeBiden,There’s enormous opportunity once we get rid of Donald Trump. We can: - Address the climate emergency - Build a more inclusive middle class - Build on Obamacare - Ensure our government works for everyone — not just the powerful,2020-01-12
JoeBiden,"Trump’s reckless policies have needlessly endangered our interests in the Middle East. But none of us should be under any illusions about the Iranian regime, and the Iranian people — like all people everywhere — have the right to peaceful protest. The world should support them.",2020-01-12
JoeBiden,"Gracias por su apoyo, Mayor @EricGarcetti. Estoy orgulloso de caminar junto a los bomberos, los Angelenos, y los Americanos. Y hoy, me siento orgulloso de caminar junto a ti. Vamos.",2020-01-12
JoeBiden,"Thank you for your endorsement, Mayor @EricGarcetti. I’m proud to walk with firefighters, Angelenos, and Americans. And today, I’m proud to walk with you. Let’s do this.",2020-01-12
JoeBiden,"I want to congratulate my friend Iowa Attorney General Tom Miller on making history. I've known Tom for years, he has never been afraid to take on the tough fights and has always served with honor and integrity—Iowa and our nation are better because of it.",2020-01-12
JoeBiden,I've seen firsthand how hard our educators work for little pay and with few resources. They deserve better. It's time we support our educators by giving them the pay and dignity they deserve.,2020-01-11
JoeBiden,What kind of nation are we if we simply accept that kids learn active shooter drills with their ABCs? We have to take on the @NRA and pass common-sense gun safety reforms to protect our children.,2020-01-11
JoeBiden,Congratulations to President Tsai and the people of Taiwan for another successful election. You are stronger because of your free and open society. The United States should continue strengthening our ties with Taiwan and other like-minded democracies.,2020-01-11
JoeBiden,Members of Teamsters Local 104 are striking against ASARCO for their unfair labor practices—I called into the picket line to support them. Every company should provide its workers with the pay and benefits they've earned—especially one that pulls in over $1 billion in profits.,2020-01-11
JoeBiden,"Firefighters represent the best of America — courageous, selfless, and always answering the call to duty. I'm grateful to those who are heading to help our friends in Australia battle devastating wildfires.",2020-01-11
JoeBiden,"Being a nation of immigrants is and has always been one of our greatest strengths. Our diversity has always made us stronger, but Donald Trump doesn’t get that.",2020-01-11
JoeBiden,Make no mistake: the situation with Iran is a crisis of Donald Trump's own making. He brought us to the brink of war with no plan and no strategy. He is the most erratic and incompetent commander in chief we've ever had.,2020-01-10
JoeBiden,"I've released 21 years of my tax returns. Why haven't you released any of yours, Mr. President? Release your taxes or hush up about corruption.",2020-01-10
JoeBiden,Donald Trump brought us dangerously close to starting a new war with Iran without any semblance of a plan. This moment requires a leader who will be ready on day one to pick up the pieces and repair the damage Trump has caused.,2020-01-10
JoeBiden,"I started the Cancer Moonshot so we could be the generation that finally cures cancer. You then tried to slash nearly $1 billion for cancer funding. We're lucky that the cancer rate is down, but we're luckier that Congress stopped you.",2020-01-10
JoeBiden,This election is about the soul of America — and a nation that allows our epidemic of school shootings to continue has a troubled soul. We have to beat the @NRA and get weapons of war off our streets. Lives depend on it.,2020-01-09
JoeBiden,Facebook continues to put their profits over the truth — allowing politicians like Donald Trump to spend an unthinkable amount of money on paid disinformation. Our democracy is worse off for their failure to confront this.,2020-01-09
JoeBiden,"We are so much better than who Donald Trump thinks we are. We don’t have to give in to his dark, petty, angry vision of America. We can choose to be the more perfect union we have always aspired to be — and restore the soul of this nation.",2020-01-09
JoeBiden,"Instead of using his statement today to lay out a coherent strategy on Iran, Donald Trump used it to mislead the country on the Obama-Biden record. He's been President for three years. It's time he stops blaming President Obama for his failures.",2020-01-09
JoeBiden,"I'm thankful no one was hurt in last night's attack. But we're only in this mess because Donald Trump pulled out of the Iran Deal (which even his advisors said was working), turned his back on our allies, and had no strategy for what comes next.",2020-01-09
JoeBiden,Gabby is one of the strongest people I know. The resilience she has shown is remarkable. I'm inspired by her courage in turning tragedy into purpose and grateful for her relentless determination to make our country a safer place for all.,2020-01-09
JoeBiden,"3,820 days — that's how long it's been since the federal minimum wage was last raised. It’s unacceptable. Raising the minimum wage to $15 an hour nationwide should be just our starting point for ensuring workers receive the pay they deserve.",2020-01-08
JoeBiden,"Pope Francis is absolutely right. As a nation, we have a moral obligation to ensure everyone has access to the care they need. Health care is a right for all — not a privilege for the few.",2020-01-08
JoeBiden,"We have to rebuild the middle class. But this time, we have to make sure that people historically left out of the middle class — whether due to race, gender, sexual orientation, disability, or religion — have the chance to be included in our success. https://www.theurbanvoice.com/article/building-an-inclusive-middle-class-by-former-vice-president-joe-biden.html",2020-01-08
JoeBiden,"I’m going to hold off on commenting on the news tonight until we know more, but there is one thing I will say: Jill and I are keeping our troops and Americans overseas in our prayers. We hope you’ll keep them in yours.",2020-01-08
JoeBiden,"Donald Trump says he wants to end endless wars in the Middle East, yet he is bringing us dangerously close to starting a new one.",2020-01-07
JoeBiden,"Estoy con el pueblo de Puerto Rico, nuestros conciudadanos, en este momento de necesidad. Es inconcebible que gran parte del arduo trabajo de la recuperación ante desastres aún no se haya hecho. Tenemos que ofrecer apoyo concreto a Puerto Rico antes de que se pierdan más vidas.",2020-01-07
JoeBiden,"I stand with the people of Puerto Rico, our fellow citizens, in this moment of need. It’s unconscionable that so much of the hard work of disaster recovery continues to be left undone. We've got to deliver concrete support for Puerto Rico now before more lives are lost.",2020-01-07
JoeBiden,"Nicolás Maduro is a dictator. I strongly condemn his regime’s violent takeover of the Venezuelan National Assembly, the country’s sole remaining democratic institution.",2020-01-07
JoeBiden,Donald Trump is the most reckless & incompetent commander in chief we've ever had. Every day he directs American national security is a dangerous day for the world. We have to get him out of the White House. Chip in to help make him a one-term president:,2020-01-07
JoeBiden,"At 1:00 PM, I'll be speaking about the escalating situation with Iran and the imperative need to restore respected, responsible, and dignified leadership on the world stage. Tune in to watch live:",2020-01-07
JoeBiden,"Trump wants to ignore climate science when making infrastructure decisions. In the Biden Administration, every dollar spent toward rebuilding our roads, bridges, buildings, the electric grid, and our water infrastructure will be used to reduce and withstand a changing climate.",2020-01-07
JoeBiden,"On Día de los Reyes, as Christmas comes to a close, we are reminded of the call of the three kings: to give of ourselves without expectation, seek peace no matter how long the journey, and know that a bright future is within reach. Jill and I wish a Happy Three Kings’ Day to all!",2020-01-06
JoeBiden,Let's be clear: Donald Trump does not have the authority to take us into war with Iran without Congressional approval. A president should never take this nation to war without the informed consent of the American people.,2020-01-06
JoeBiden,John Deere is laying off yet another round of workers in Iowa because of Donald Trump's reckless trade war. All he's succeeded at is taking jobs away from American workers. It has to stop.,2020-01-06
JoeBiden,I stand in solidarity with those marching in New York against the rise of anti-Semitism. This is what the battle for the soul of our nation looks like — and it's up to all of us to reject intolerance in all its forms and give hate no safe harbor.,2020-01-06
JoeBiden,"Our Statue of Liberty invites in the tired, the poor, the huddled masses yearning to breathe free. But Donald Trump has slammed the door in the face of families fleeing persecution and violence. Jill traveled to Matamoros to shed light on how these policies hurt asylum seekers.",2020-01-06
JoeBiden,This is a crisis of Donald Trump’s own making. He claimed pulling out of the Iran deal would deter Iranian aggression and result in a better deal. He has failed on both counts. He is the most erratic and incompetent commander in chief we’ve ever had.,2020-01-05
JoeBiden,"Hey @realDonaldTrump, do you think the American people want another war in the Middle East? Des Moines certainly doesn’t.",2020-01-05
JoeBiden,"The more the walls close in on this guy, the more irrational he becomes.",2020-01-05
JoeBiden,"The world is burning, yet Donald Trump continues to deny the evidence of climate change before all of our eyes. We have to get him out of the White House and take urgent global action to combat the climate crisis before it’s too late.",2020-01-04
JoeBiden,"This simply shouldn’t happen in America. Folks deserve access to affordable, quality long-term care in their homes. We have to fight for Alex and those who use long-term care.",2020-01-04
JoeBiden,"We can overcome four years of Donald Trump, but if we give him eight years in the White House he will forever and fundamentally alter the character of this nation. We can't let that happen.",2020-01-04
JoeBiden,"On the trail, I hear countless stories from folks whose lives have been changed by Obamacare. We can't afford to start over—we need a president who will protect and build on it to ensure everyone has access to quality, affordable care.",2020-01-04
JoeBiden,The prospect of direct conflict with Iran is greater than ever. Does Donald Trump have a strategy for what comes next? Nothing we have seen from this Administration suggests that they are prepared to deal with the risks we now confront.,2020-01-04
JoeBiden,We need a leader who will be ready on day one to pick up the pieces of Donald Trump's broken foreign policy and repair the damage he has caused around the world.,2020-01-03
JoeBiden,"Our world has been set on edge by an erratic, unstable, and dangerously incompetent commander in chief. The stakes could not be higher. Every day that Donald Trump directs American national security is a dangerous day for the United States and the world.",2020-01-03
JoeBiden,My statement on the killing of Qassem Soleimani.,2020-01-03
JoeBiden,Donald Trump stacked the Supreme Court with justices to try to overturn Roe v. Wade—and now Republicans are seizing the opportunity to restrict a woman's constitutional right to choose. We have to fight these attacks and ensure this choice remains between a woman and her doctor.,2020-01-03
JoeBiden,We're just one full day into 2020 and there have already been at least three mass shootings across the country. Enough is enough. We have a moral obligation to do everything in our power to end this gun violence epidemic.,2020-01-03
JoeBiden,"Before the holidays, Jill walked across the Gateway International Bridge into Matamoros, Mexico, where families are enduring inhumane conditions. Jill witnessed the cruelty of Trump's policies and the resiliency of those risking their lives to seek asylum.",2020-01-03
JoeBiden,"If you're a teacher or a firefighter, you're probably paying more in taxes than Amazon or Netflix. We've got to make sure corporations pay their fair share.",2020-01-02
JoeBiden,I'm excited to share that we raised $22.7 million this last quarter — our biggest quarter so far this campaign! Thank you to everyone who chipped in what you could — your support means the world to me. You truly are the heart of our campaign.,2020-01-02
JoeBiden,"Like Vicky said, we need a president who will restore integrity to the White House.",2020-01-02
JoeBiden,"It was a privilege to work with @JulianCastro during the Obama Administration, and a true honor to be in this talented field of candidates with him. He led his historic campaign with grace and heart and used his platform to lift the voices of others. Thank you, Mr. Secretary.",2020-01-02
JoeBiden,Every day that Donald Trump remains in the White House puts the future of our planet at risk. We have to beat him this November and take immediate action to address the climate emergency.,2020-01-02
JoeBiden,This election is about the soul of our nation — and Donald Trump is poison to our soul.,2020-01-02
JoeBiden,"With just over one month until the Iowa Caucus, we need all hands on deck to talk with folks about what's at stake in this election. Join our team today and let's get to work:",2020-01-02
JoeBiden,"Every single human being deserves to be treated with dignity. Everyone. The poor and the powerless, the marginalized and vulnerable, the “least of these.” That has been the animating principle of my life and my faith.",2020-01-01
JoeBiden,Our final fundraising deadline of 2019 is just hours away and we need your help. Every donation — big or small — goes a long way to helping us make Donald Trump a one-term president. Chip in before midnight to help us reach our goal:,2020-01-01
JoeBiden,"As we move into the New Year, there's one thing I know: in 2020 we're going to beat Donald Trump and take back this country.",2019-12-31
JoeBiden,2019 was a year of record violence — it will be a moral failure if we allow 2020 to be the same. We have to elect leaders with the courage to take on the @NRA and pass common-sense gun safety reform. We have to end this epidemic.,2019-12-31
JoeBiden,"Next year could give us one of two things: a new administration or four more years of Donald Trump. We can defeat him, but only with your help. Chip in what you can before our midnight deadline: https://secure.actblue.com/donate/biden2020_fr_q42019-social11?refcode=social-tw-20191231eoq3&amp;utm_medium=social&amp;utm_source=tw&amp;utm_campaign=20191231eoq3",2019-12-31
JoeBiden,It will take years to repair the damage Betsy DeVos is doing to our schools. Our students and educators deserve a Secretary of Education who values our public schools — and is actually an educator.,2019-12-31
JoeBiden,"We all said that Donald Trump’s trade war would lead to job losses and higher prices. And now, it’s leading to job losses and higher prices. I didn't read “Art of the Deal,” but this is the textbook definition of a failed negotiation.",2019-12-31
JoeBiden,"Tomorrow marks our end-of-year fundraising deadline and we need your help to reach our goal. Our campaign relies on supporters like you giving $5, $10, $20 at a time. Chip in to help us end the year on a strong note: https://joe.link/2ZBAPIw",2019-12-30
JoeBiden,"Health care should be more than just a luxury reserved for those who can afford it. It’s a right we all deserve – one that is central to our dignity, and to who we want to be as a country.",2019-12-30
JoeBiden,"My dad had a saying: “Joey, the greatest sin of all is the abuse of power.” Right now, our democracy is at risk. We’ve got to come together and fight back against Donald Trump — Democrats, Republicans, Independents alike.",2019-12-30
JoeBiden,Scripture is clear: It’s not enough to just wish the world were better. It’s our duty to make it so—including by leading the world in addressing the climate crisis and providing a roadmap to citizenship for those contributing to our communities.,2019-12-30
JoeBiden,"Congressman Lewis has always fought in the name of building a more just, more fair country. If there's anybody who can take the fight to cancer, it's you, John. Jill and I are sending our prayers to you and your family. Keep the faith, and keep up the fight.",2019-12-30
JoeBiden,No one in America should work full time and live below the poverty line. It’s past time we raise the minimum wage to $15 an hour and provide a reliable pathway to the middle class.,2019-12-29
JoeBiden,"Donald Trump will stop at nothing to sabotage Obamacare and roll back the progress we've made. We have to protect the ACA and build on it to ensure every American has access to quality, affordable care.",2019-12-29
